{"attempts":"53436416","calibration_version":"ap-calibration-v2","conditions":"Reference measurement on the detected CPU in this WSL2 environment; one Python process and one thread; no CPU affinity or frequency controls; background load uncontrolled. V4 30-second expected-work policy.","cpu":"AMD Ryzen 7 7800X3D 8-Core Processor","elapsed_ns":"15000964391","expected_seconds":"30","implementation":"python-hashlib-copy-sha256-u64be-v1","measured_at":"2026-09-17T17:56:21Z","platform":"Linux-6.6.87.2-microsoft-standard-WSL2-x86_64-with-glibc2.39","profile":"production","python":"3.12.12","target":"0000002830b2bfc8b92feeec19a17937b730b24db3255c40694990cee4fb4ee3","threads":"1"}
